<?xml version="1.0" encoding="UTF-8"?>
<update
xmlns:xsi="http://www.w3.org/2001/XMLSchema-instance"
xsi:noNamespaceSchemaLocation="http://www.l8m.com/xml-schema/updateTranslation.xsd">
	
	<serverip></serverip>
	<apikey></apikey>
	<short></short>
	<translations>
		<short>HTTP/1.1 403 Forbidden</short>
		<translation lang="en">
			<text>HTTP/1.1 403 Forbidden</text>
		</translation>
		<translation lang="de">
			<text>HTTP/1.1 403 Forbidden</text>
		</translation>
	
	</translations>
	
</update>